{
  "schemaVersion": "clearcutt.catalog.index/v2",
  "generatedAt": "2026-06-05T20:00:00Z",
  "generator": {
    "name": "clearcutt",
    "version": "test",
    "commit": "fixture"
  },
  "source": {
    "owner": "test-owner",
    "repo": "test-repo",
    "repoUrl": "https://github.com/test-owner/test-repo",
    "registryBase": "ghcr.io/test-owner/test-repo"
  },
  "summary": {
    "imageCount": 2,
    "releaseCount": 1,
    "signedCount": 2,
    "provenanceCount": 2,
    "sbomCount": 2,
    "scanCount": 2,
    "passingCount": 2
  },
  "owner": "test-owner",
  "repo": "test-repo",
  "repoUrl": "https://github.com/test-owner/test-repo",
  "registryBase": "ghcr.io/test-owner/test-repo",
  "latestTag": "v1.0.0",
  "releases": [
    { "tag": "v1.0.0", "publishedAt": "2026-06-05T20:00:00Z", "isLatest": true }
  ],
  "languages": [
    { "id": "java", "displayName": "Java", "version": "21", "icon": null },
    { "id": "service", "displayName": "Service", "version": "16", "icon": null }
  ],
  "tiers": [
    { "id": "distroless", "name": "Distroless", "blurb": "Hardened tier" },
    { "id": "service", "name": "Service", "blurb": "Platform-owned service image" }
  ],
  "images": [
    {
      "id": "java21-distroless",
      "kind": "runtime",
      "language": "java",
      "languageDisplay": "Java",
      "languageVersion": "21",
      "tier": "distroless",
      "latestTag": "v1.0.0",
      "latestManifestDigest": "sha256:1234567890abcdef1234567890abcdef1234567890abcdef1234567890abcdef",
      "latestPackageCount": 2,
      "architectures": ["amd64"],
      "signed": true,
      "provenance": true,
      "passed": true,
      "evidence": {
        "signature": true,
        "provenance": true,
        "sbom": true,
        "tests": true,
        "vulnerabilities": true,
        "archCount": 1,
        "sbomArchCount": 1,
        "testArchCount": 1,
        "passedTestArchCount": 1,
        "vulnerabilityArchCount": 1
      },
      "lifecycle": {
        "status": "active",
        "support": "lts",
        "productionAllowed": true,
        "deprecatedAt": null,
        "eolAt": null,
        "reason": null
      },
      "runtimeContract": {
        "user": "10001",
        "workingDir": "/app",
        "shellPresent": false,
        "packageManagerPresent": false,
        "caCertificatesPresent": true,
        "timezoneDataPresent": true,
        "defaultEntrypoint": "/usr/local/bin/java",
        "productionTier": true
      }
    },
    {
      "id": "postgres16",
      "kind": "service",
      "language": "service",
      "languageDisplay": "Service",
      "languageVersion": "16",
      "tier": "service",
      "latestTag": "v1.0.0",
      "latestManifestDigest": "sha256:abcdef1234567890abcdef1234567890abcdef1234567890abcdef1234567890",
      "latestPackageCount": 3,
      "architectures": ["amd64"],
      "signed": true,
      "provenance": true,
      "passed": true,
      "evidence": {
        "signature": true,
        "provenance": true,
        "sbom": true,
        "tests": true,
        "vulnerabilities": true,
        "archCount": 1,
        "sbomArchCount": 1,
        "testArchCount": 1,
        "passedTestArchCount": 1,
        "vulnerabilityArchCount": 1
      },
      "vulnSummary": {
        "critical": 0,
        "high": 0,
        "medium": 0,
        "low": 0,
        "scannedAt": "2026-06-05T20:10:00Z",
        "remediation": {
          "eligible": 0,
          "baseLayer": 0,
          "noFixedVersion": 0,
          "belowPriorityThreshold": 0,
          "otherDeferred": 0
        }
      },
      "lifecycle": {
        "status": "preview",
        "support": "current",
        "productionAllowed": false,
        "deprecatedAt": null,
        "eolAt": null,
        "reason": null
      },
      "runtimeContract": {
        "user": "10001:10001",
        "workingDir": "/app",
        "shellPresent": true,
        "packageManagerPresent": false,
        "caCertificatesPresent": true,
        "timezoneDataPresent": false,
        "defaultEntrypoint": "/bin/clearcutt-postgres-entrypoint",
        "productionTier": false
      },
      "service": {
        "template": "postgres",
        "version": "16",
        "ports": [
          { "name": "postgres", "port": 5432, "protocol": "tcp" }
        ],
        "stateful": true,
        "dataDirs": ["/var/lib/postgresql/data"],
        "smoke": ["postgres --version", "initdb --version", "pg_isready --version"],
        "smokeStatus": "passed"
      }
    }
  ]
}
